{
  "contractVersion": "0.1.0",
  "sourceSystemId": "SYNTH-LEGACY-SYSTEM",
  "sourceRecordId": "SYNTH-LEGACY-0001",
  "sourceHash": "cccccccccccccccccccccccccccccccccccccccccccccccccccccccccccccccc",
  "recordHash": "dddddddddddddddddddddddddddddddddddddddddddddddddddddddddddddddd",
  "observedAt": "2026-09-10T00:00:00Z",
  "reconciliationOutcome": "ConfirmedHistoricalReference",
  "reviewedBy": "SYNTH-REVIEWER-001",
  "reviewedAt": "2026-09-10T00:05:00Z",
  "authoritativeDecision": false,
  "productionWrite": false,
  "currentRegistrationEstablished": false,
  "currentScopeEstablished": false
}
